archive/repo_cleanup_2026-04-24/blumen_gep/supersonic_mach_branch_tracking_a020_anchor130_candidates.csv

alpha,Mach,rank,cand_cr,cand_ci,cand_omega_i,distance_to_target,distance_to_shooting,overlap_to_previous,overlap_to_anchor,score,target_cr,target_ci,shooting_cr,shooting_ci
0.2,1.2000000000000004,1,0.35864924000154214,0.007669897254044323,0.0015339794508088646,0.05098731902207555,0.16301141399897906,0.9774444002134026,0.490449034663735,1.6564676232287392,0.3351814632255714,0.030302673013173582,0.239853515625,0.06348274739583332
0.2,1.2000000000000004,2,0.34867249045476745,0.007585415759515293,0.0015170831519030587,0.04739517828022667,0.15601158937477574,0.9703043235554696,0.46295859100933945,1.6804889212617784,0.3351814632255714,0.030302673013173582,0.239853515625,0.06348274739583332
0.2,1.2000000000000004,3,0.3387091505948708,0.007496598095780629,0.001499319619156126,0.04574836380381788,0.14936610130510702,0.9622092255217044,0.435058904344138,1.7441580709226085,0.3351814632255714,0.030302673013173582,0.239853515625,0.06348274739583332
0.2,1.2000000000000004,4,0.32875971877288723,0.007403699021659179,0.001480739804331836,0.04624598189326065,0.14312145759593578,0.9531857326702673,0.4068275980128925,1.8512631990685593,0.3351814632255714,0.030302673013173582,0.239853515625,0.06348274739583332
0.2,1.2000000000000004,5,0.3188245726927769,0.007307005498954715,0.001461401099790943,0.04881342812792219,0.13732910749386296,0.9432668666501337,0.3783433413852446,2.0002146789153463,0.3351814632255714,0.030302673013173582,0.239853515625,0.06348274739583332
0.2,1.2250000000000003,1,0.398733428292619,0.008182623424733759,0.0016365246849467518,0.04708612961511559,0.17703054980924213,0.9675385396923034,0.6623727798654836,1.6250093128585006,0.37714530704849175,0.029105437667088487,0.2543155924479167,0.05937662760416666
0.2,1.2250000000000003,2,0.3887116914764873,0.008110317419285938,0.0016220634838571878,0.043554122027828004,0.16904215354161514,0.9592340438829208,0.6389492896943325,1.6256118787802505,0.37714530704849175,0.029105437667088487,0.2543155924479167,0.05937662760416666
0.2,1.2250000000000003,3,0.37869966007911215,0.00803408171324588,0.001606816342649176,0.042171366829615003,0.16129359675674368,0.9498941056549515,0.614642724805184,1.6734529149178694,0.37714530704849175,0.029105437667088487,0.2543155924479167,0.05937662760416666
0.2,1.2250000000000003,4,0.36869830458684394,0.007953724135088483,0.0015907448270176966,0.04313851865730037,0.1538202354731562,0.9395126361572748,0.5894968297708298,1.7728018048067977,0.37714530704849175,0.029105437667088487,0.2543155924479167,0.05937662760416666
0.2,1.2250000000000003,5,0.3587085058756574,0.007869162326504552,0.0015738324653009105,0.04630154639805241,0.14666272972793748,0.928091628598931,0.5635631330012476,1.920367325445069,0.37714530704849175,0.029105437667088487,0.2543155924479167,0.05937662760416666
0.2,1.2500000000000002,1,0.4590317834488752,0.00892464437570303,0.0017849288751406061,0.039869189443792065,0.2123648954497626,0.9517945471527014,0.82942784093875,1.5157312518740738,0.4524324607171546,0.02858425529751158,0.2680387369791668,0.05534798177083333
0.2,1.2500000000000002,2,0.46908209568824694,0.009011150186677926,0.0018022300373355853,0.04253981804603296,0.2213748854907923,0.9594568886488006,0.843635599840275,1.5229863758772544,0.4524324607171546,0.02858425529751158,0.2680387369791668,0.05534798177083333
0.2,1.2500000000000002,3,0.4489816222144881,0.00884289147250107,0.001768578294500214,0.03963324449319308,0.20344832614673145,0.9432639952037979,0.8142740441935257,1.561539952150356,0.4524324607171546,0.02858425529751158,0.2680387369791668,0.05534798177083333
0.2,1.2500000000000002,4,0.4389331677812779,0.008764150951206803,0.0017528301902413606,0.04187573348566266,0.19464100198700138,0.9338236015883836,0.798146812006129,1.6615543130085846,0.4524324607171546,0.02858425529751158,0.2680387369791668,0.05534798177083333
0.2,1.2500000000000002,5,0.42888784608910463,0.008686962144988838,0.0017373924289977678,0.04623805767085268,0.18596085316957026,0.9234344914768284,0.781023202500211,1.8081840064829835,0.4524324607171546,0.02858425529751158,0.2680387369791668,0.05534798177083333
0.2,1.2750000000000001,1,0.5753616098758131,0.010741770981963742,0.0021483541963927487,0.025925613032541265,0.3051351514461818,0.9604045759551896,0.9604045759551896,1.3603864640535313,0.5724365028641387,0.023621805532415528,0.28134521484375,0.05155175781249999
0.2,1.2750000000000001,2,0.5658401767482032,0.011418196213982981,0.0022836392427965963,0.025282876414987037,0.29560141138929646,0.955424127643563,0.955424127643563,1.385123424577421,0.5724365028641387,0.023621805532415528,0.28134521484375,0.05155175781249999
0.2,1.2750000000000001,3,0.5850952524032815,0.0101596771991501,0.00203193543983002,0.02975163082824166,0.31482900544172393,0.9650572618478455,0.9650572618478455,1.4321557014935662,0.5724365028641387,0.023621805532415528,0.28134521484375,0.05155175781249999
0.2,1.2750000000000001,4,0.5567335259671332,0.011984198907809192,0.0023968397815618387,0.028077019699822372,0.2865328755554832,0.9509149507724548,0.9509149507724548,1.506808679744331,0.5724365028641387,0.023621805532415528,0.28134521484375,0.05155175781249999
0.2,1.2750000000000001,5,0.54784401855408,0.011962606919983644,0.002392521383996729,0.033890086067713314,0.27801225845742616,0.9471278671029227,0.9471278671029227,1.699610053902046,0.5724365028641387,0.023621805532415528,0.28134521484375,0.05155175781249999
0.2,1.3,1,0.766497361544398,0.00500183734569255,0.0010003674691385102,0.004453109294280677,0.01113277323570164,1.0,1.0,0.2235857617076312,0.7645416460933054,0.0030015024074155298,0.7616080729166668,1e-06
0.2,1.3,2,0.7575074975335041,0.005181224589096918,0.0010362449178193836,0.008275506094409614,0.011142424585651766,0.9999659312942987,0.9999659312942987,0.738889199121181,0.7645416460933054,0.0030015024074155298,0.7616080729166668,1e-06
0.2,1.3,3,0.7753914565025086,0.004824196553497808,0.0009648393106995616,0.011445839493733269,0.016823631089902893,0.9999681200226698,0.9999681200226698,0.8947126816989714,0.7645416460933054,0.0030015024074155298,0.7616080729166668,1e-06
0.2,1.3,4,0.7484272733489573,0.005362495121827104,0.001072499024365421,0.016791966988230052,0.016991644917712736,0.9998590893700596,0.9998590893700596,1.4932402165313199,0.7645416460933054,0.0030015024074155298,0.7616080729166668,1e-06
0.2,1.3,5,0.7841842500810048,0.0046481952030227565,0.0009296390406045513,0.01991678387867884,0.0244145339577795,0.9998766144297484,0.9998766144297484,1.6366839169385896,0.7645416460933054,0.0030015024074155298,0.7616080729166668,1e-06
0.2,1.325,1,0.7664960552448612,0.0049001039938147755,0.0009800207987629552,0.004241806082148286,0.010879042795505866,0.9995931855069612,0.9995931855069612,0.2605050222827833,0.7645943804683055,0.003004282807444465,0.7617399088541668,7.951000072337961e-06
0.2,1.325,2,0.7575061098927891,0.005071126059623425,0.001014225211924685,0.008205543484013882,0.010975792471616942,0.9997818600463332,0.9997818600463332,0.6692785988391595,0.7645943804683055,0.003004282807444465,0.7617399088541668,7.951000072337961e-06
0.2,1.325,3,0.7753902126345297,0.004730319268098809,0.0009460638536197618,0.011334319547961965,0.016599212075627066,0.9993539262272079,0.9993539262272079,0.9168725999282054,0.7645943804683055,0.003004282807444465,0.7617399088541668,7.951000072337961e-06
0.2,1.325,4,0.7484257781923731,0.005243468861303413,0.0010486937722606828,0.016777351289535326,0.01693837844601402,0.9999144093267722,0.9999144093267722,1.4057371899917537,0.7645943804683055,0.003004282807444465,0.7617399088541668,7.951000072337961e-06
0.2,1.325,5,0.7841830553829259,0.004561709923422764,0.0009123419846845529,0.019834780104579293,0.02422068759220776,0.9990692194209221,0.9990692194209221,1.6412752173882115,0.7645943804683055,0.003004282807444465,0.7617399088541668,7.951000072337961e-06
0.2,1.3499999999999999,1,0.7664961724996018,0.004825429539385922,0.0009650859078771845,0.0042008073490679585,0.010699557798540949,0.9996507692401441,0.998491484104886,0.24922625437893184,0.7644991956469167,0.0029775343966746675,0.76150390625,9.368000096450614e-05
0.2,1.3499999999999999,2,0.7575063101752932,0.004989638416045494,0.000997927683209099,0.008068128504077975,0.010576502710505021,0.9998146351550993,0.9988605420690732,0.674401926411511,0.7644991956469167,0.0029775343966746675,0.76150390625,9.368000096450614e-05
0.2,1.3499999999999999,3,0.7753902498724605,0.004662090638705904,0.0009324181277411809,0.011400262324788909,0.016622636440142877,0.9994417520404411,0.9980835581342492,0.9140567714305792,0.7644991956469167,0.0029775343966746675,0.76150390625,9.368000096450614e-05
0.2,1.3499999999999999,4,0.7484260616294305,0.005154769113137312,0.0010309538226274625,0.016652538580839666,0.01653748807785435,0.999928678768165,0.9991862201556896,1.4137436809193855,0.7644991956469167,0.0029775343966746675,0.76150390625,9.368000096450614e-05
0.2,1.3499999999999999,5,0.784183017738032,0.004499586386694387,0.0008999172773388775,0.01991781667643245,0.024330847543927604,0.9991919256746342,0.9976409550804326,1.642159566417895,0.7644991956469167,0.0029775343966746675,0.76150390625,9.368000096450614e-05

problèmes_supersoniques.md

### Ce qui est solide aujourd'hui

- le **shooting supersonique** retrouve une branche instable cohérente à `alpha = 0.2` pour `M = 1.20, 1.25, 1.275, 1.30` ;
- cette branche reproduit bien `c_i` de Blumen ;
- elle est cohérente avec ses propres conditions asymptotiques ;
- elle est continue en `Mach` et donne une structure modale visuellement crédible ;
- le **GEP dense actuel** ne retrouve pas la bonne croissance `c_i` et ne peut donc pas servir de solveur classique de référence.

## 2. Continuité modale en `Mach`

- `overlap_prev_mach_center8 = 0.9985, 0.9997, 0.9992`
- `rel_l2_prev_mach_center8 = 0.0675, 0.0517, 0.0464`

- on suit bien une même famille modale ;
- il n'y a pas de saut de branche visible entre `M=1.20` et `M=1.30`.